{
  "schema_version": "platform-remedy-case-ledger-v1",
  "checked": "2026-09-15",
  "purpose": "Keep formal rights, reported practices, adjudicated orders, and verified worker outcomes separate.",
  "coding": {
    "observed_rule": "A law, directive, contract, or formal rule specifies the route.",
    "observed_practice": "An institutional or operational practice is reported, without a case-level outcome.",
    "observed_self_report": "Workers report an experience or outcome, without independent case-file verification.",
    "observed_adjudicated": "A court or tribunal made a finding or order.",
    "observed_commitment": "An organization committed to a recommendation, without completed remediation proof.",
    "observed_rule_or_expectation": "A regulator or guidance source states an expected right or safeguard.",
    "observed_case_report": "A public report identifies a specific proceeding or hearing, but the primary adjudicative record or final outcome is not yet available.",
    "observed_comparative_audit": "A structured country or platform assessment documents a formal process or standard; it does not establish that an individual used it or obtained a remedy.",
    "observed_official_action": "An official institution took a documented dialogue, directive, inspection, or capacity-building action; this does not establish a binding rule or worker outcome.",
    "observed_official_service": "An official public service is listed as operational; scope, specialized use, and outcomes must still be measured.",
    "not_observed": "The current source packet does not establish the event; this is not proof that it never occurred."
  },
  "stage_fields": ["explanation", "human_review", "correction_restoration", "payment_compensation", "anti_retaliation"],
  "implementation_stage_vocabulary": {
    "formal_institutions_reported_established": "An official source reports that the responsible dispute institution has been constituted; this does not establish use or outcome.",
    "implementation_artifacts_visible": "A public portal, regulation, or guidance route is visible; this does not establish institutional exercise.",
    "case_hearing_reported": "A public report identifies a proceeding or hearing; the primary record or final outcome is not yet available.",
    "adjudicated_remedy_and_payment_order": "A primary adjudicative record establishes a remedy and a payment or lost-remuneration order; receipt and durability may remain open."
  },
  "records": [
    {
      "id": "PR-023",
      "place": "Australia",
      "population": "Satbir Singh and Portier Pacific / Uber delivery platform",
      "source_type": "Fair_Work_Commission_primary_eligibility_decision",
      "decision_surface": ["platform_access", "service_entity_identity", "statutory_eligibility", "account_messages"],
      "worker_route": "Platform messages and statutory unfair-deactivation application",
      "implementation_stage": "adjudicated_eligibility_threshold_dismissal",
      "stages": {"explanation": "not_observed", "human_review": "not_observed", "correction_restoration": "not_observed", "payment_compensation": "not_observed", "anti_retaliation": "not_observed"},
      "evidence_strength": "high_for_eligibility_dismissal_and_platform_entity_boundary_low_for_underlying_deactivation_merits_and_later_access",
      "boundary": "[2026] FWC 409 dismissed the application because the statutory six-month regular-work protection was not met. The decision did not determine whether the underlying access restriction was fair, and later account messages did not establish qualifying work or a services agreement with the separate Uber driver platform."
    },
    {
      "id": "PR-024",
      "place": "Australia",
      "population": "Jai Phillipps-Lewis and Rasier Pacific / Uber Driver Platform",
      "source_type": "Fair_Work_Commission_primary_eligibility_decision_and_order",
      "decision_surface": ["platform_access", "regular_work_pattern", "eligibility_threshold", "lost_pay_claim"],
      "worker_route": "Worker response, statutory unfair-deactivation application, jurisdictional objection and stay",
      "implementation_stage": "eligibility_objection_dismissed_merits_stayed",
      "stages": {"explanation": "not_observed", "human_review": "not_observed", "correction_restoration": "observed_access_resumed_not_merits_remedy", "payment_compensation": "not_observed", "anti_retaliation": "not_observed"},
      "evidence_strength": "high_for_regular_work_finding_and_stay_low_for_deactivation_merits_lost_pay_and_durability",
      "boundary": "[2025] FWC 2398 found a recurring weekend work pattern sufficient to reject Uber's six-month regular-work objection despite averages below the Code's illustrative thresholds. The remaining deactivation-status, merits, and lost-pay issues were stayed pending Hotak; no payment or durable restoration is established."
    },
    {
      "id": "PR-025",
      "place": "Australia",
      "population": "Kwasi Kyei and Rasier Pacific / Uber Driver Platform",
      "source_type": "Fair_Work_Commission_primary_timing_decision",
      "decision_surface": ["deactivation_date", "filing_deadline", "internal_review", "Code_process"],
      "worker_route": "Worker challenge, internal review, statutory unfair-deactivation application and extension request",
      "implementation_stage": "timing_extension_granted_merits_relisted",
      "stages": {"explanation": "open_arguable_process_issue_not_adjudicated", "human_review": "open", "correction_restoration": "not_observed", "payment_compensation": "not_observed", "anti_retaliation": "not_observed"},
      "evidence_strength": "high_for_extension_and_relisting_low_for_merits_and_remedy",
      "boundary": "[2025] FWC 2269 granted an extension despite a 60-day filing delay because the worker pursued internal review and raised an arguable Code-process issue. The decision did not determine unfairness, restoration, payment, or later access."
    },
    {
      "id": "PR-026",
      "place": "Australia",
      "population": "Mohamed Mohamed and Portier Pacific / Uber Eats",
      "source_type": "Fair_Work_Commission_primary_merits_decision",
      "decision_surface": ["satisfaction_rating", "deactivation_warning", "platform_access", "human_response_review"],
      "worker_route": "Worker response, internal platform process, statutory unfair-deactivation merits proceeding",
      "implementation_stage": "adjudicated_code_compliant_merits_dismissal",
      "stages": {"explanation": "observed_adjudicated_sufficient", "human_review": "observed_adjudicated_sufficient", "correction_restoration": "not_observed", "payment_compensation": "not_observed", "anti_retaliation": "not_observed"},
      "evidence_strength": "high_for_code_compliance_and_dismissal_low_for_rating_accuracy_downstream_effects_and_generalization",
      "boundary": "[2025] FWC 2337 found the warning, preliminary notice, worker response, human consideration, and reasonable grounds for a persistent low-rating reason sufficient under the Code. No rating correction, restoration, payment, continued access, or downstream outcome is established."
    },
    {
      "id": "PR-027",
      "place": "Australia",
      "population": "Hasnain Ali and Portier Pacific / Uber Delivery Platform",
      "source_type": "Fair_Work_Commission_primary_merits_decision",
      "decision_surface": ["satisfaction_rating", "platform_access", "Code_compliance", "unfairness"],
      "worker_route": "Worker response, statutory unfair-deactivation merits proceeding",
      "implementation_stage": "adjudicated_code_noncompliance_without_unfairness_remedy",
      "stages": {"explanation": "observed_adjudicated_insufficient", "human_review": "observed_adjudicated_process_deficient", "correction_restoration": "not_observed", "payment_compensation": "not_observed", "anti_retaliation": "not_observed"},
      "evidence_strength": "high_for_code_noncompliance_and_no_unfairness_finding_low_for_downstream_effects_and_generalization",
      "boundary": "[2025] FWC 3243 found the deactivation process inconsistent with the Code but concluded the deactivation was not unfair in the circumstances. The application was dismissed; no restoration, rating correction, payment, or durable access is established."
    },
    {
      "id": "PR-022",
      "place": "Australia",
      "population": "Musharaf Waheed and Uber Driver Platform",
      "source_type": "Fair_Work_Commission_primary_merits_decision",
      "decision_surface": ["rider_complaints", "warnings", "platform_access", "complaint_history", "lost_remuneration", "appeal_stay", "interim_payment_obligation"],
      "worker_route": "Worker responses, union-supported application, statutory unfair-deactivation merits proceeding",
      "implementation_stage": "appeal_stay_order_and_interim_payment_obligation_observed_reactivation_and_quantum_open",
      "stages": {"explanation": "observed_adjudicated_insufficient", "human_review": "observed_adjudicated_insufficient", "correction_restoration": "observed_adjudicated_reactivation_ordered_stayed_pending_appeal", "payment_compensation": "observed_adjudicated_lost_remuneration_in_principle_interim_payment_obligation_quantum_open", "anti_retaliation": "not_observed"},
      "evidence_strength": "high_for_merits_stay_and_interim_payment_condition_low_for_final_quantum_receipt_actual_access_durability_and_generalization",
      "boundary": "[2026] FWC 1801 found the Code process deficient and deactivation unfair, ordered reactivation and lost remuneration in principle. The 16 June 2026 consent stay stayed those orders pending appeal, conditioned on Rasier paying $259.38 per week from 28 May 2026 and not seeking repayment. The public record does not establish that the weekly payments were received, that access was restored in practice, the final quantum, appeal outcome, recurrence prevention, or anti-retaliation."
    },
    {
      "id": "PR-001",